18,discussion_3.txt,"Participants in the current study outlined a range of approaches which underpin their applied work, and several of these can be seen to fall within the frameworks and models proposed by Hill (2001) and Poczwardowski and colleagues (2004). What remains unclear is how a practitioner should integrate different approaches in a complementary, considered, faithful manner. It seems that sport psychology could perhaps learn from other areas of psychology about how to truly integrate different approaches: First, there needs to be in-depth learning of the substance of two or more theoretical traditions, and second, there must be an orienting framework for theoretical and/or technical assimilation and accommodation (Boswell, 2016, p.5). Consideration must also be given to the philosophical underpinnings of MI, and how these may or may not be congruent with different action-orientated, directive, or instruction-based interventions which may be common in applied sport psychology. Nevertheless, it has been suggested that relational techniques from the MI approach can be used alongside content-based interventions, irrespective of theoretical stance (Hardcastle et al., 2017; Hardcastle, 2016).
This study investigated the level of understanding and use of MI with applied sport psychologists who are not experts in the MI approach, and identified some explicit understanding and use, and much implicit use of MI. It is now pertinent for future research to investigate this area with practitioners who are experts in MI and are working in sport. This will begin the process of identifying best practice around applying MI in sport as part of an integrated approach, and as an intervention in its own right, which might then inform the training curricula of students and neophyte practitioners in this discipline. Participants in the current study cited a lack of research on this approach in this domain, and a lack of sport-specific examples for practitioners, as barriers to learning and using MI in sport psychology. As such, it will be important for future research to fill these knowledge gaps. Based on existing literature highlighting the important role of relationships between practitioner and athletes (e.g., Sharp et al., 2015), one avenue for future research could be in the development of a sport-specific measure of the therapeutic alliance, as an ongoing assessment of the strength of the consultancy relationship from the perspective of the client. Another avenue worthy of exploration would be adaptions to MI for working with different sporting populations, including groups (teams) and adolescents. Finally, an exploration of integrating MI with different action-orientated approaches in sport psychology (e.g., rational emotive behavior therapy (Wood, Barker, & Turner, 2017); solution focused therapy (Hoigaard & Johansen, 2004)) may further enhance professional practice.
Although this study has generated novel information about the role of MI in applied sport psychology, there are some limitations which must be acknowledged. The practitioners sampled are well established in the discipline and are currently working at the elite level. Therefore, their experiences are perhaps not representative of those who are just beginning their careers, regarding the level of athlete that they work with, and the nature of the work itself. At the elite level, practitioners are perhaps less likely to encounter disengagement and resistance, for example. When neophytes are beginning the training process, they may experience increased levels of ambivalence or disengagement, given that they are unlikely to be working with elite athletes. In addition, the participants sampled in the current study are working primarily with athletes individually. Again this is perhaps not representative of the neophytes experience, where they are potentially delivering workshops and seminars to teams or groups of athletes and coaches. Both of these examples support the need to explore MI in sport psychology when working with resistant athletes and for adaptations for working with teams.
This study has begun the process of exploring the application of MI in sport psychology, and identified the need to clarify the system of integrating different approaches. It is proposed here that this counseling approach can underpin the delivery of sport psychologys dominant action-orientated interventions, and enhance the practitioner-athlete relationship. Discrepancy between responses related to explicit and implicit use of MI indicates that the MI approach has more to offer applied sport psychologyto the training curricula for students of the discipline, and ongoing professional development of neophyte practitioners and established practitioners alike.",4,26,31.384615384615383,0,0.5190915995836258,0.4605612597331548,0.5349527343442397,0.5274576780031479,0.0,0.3588218766044041,0.34137865228491954,0.3660246688999339,0.3478856389734657,0.23592491501844243,0.23200630229883157,0.24206952571454976,0.23951002616820494,0.18092100821621254,1.4657475682863035,0.29704716157888506,0.16867487112378993,1.4086251460273813,0.28323060439724423,0.1666030541931395,1.4112300453513509,0.28256591515507845,0.17002778820378023,1.4148124228027377,0.2847264403220097,0.03944444444444444,0.04152907224989605,0.013157894736842105,0.03691045796308954,2.93007203544136,3.3801193220654366,0,0,1.168516451021098,6.484740724819721,8.846442297790691,-0.8189859542883079,0.356552108444699,1.0218784739204958,,-0.2555135661885194,0.5364687842271841,1.5276117276237087,1.670487256000897,-0.6381081815864973,-1.0563232027424783,-1.4988777777033828,0.3231064956294753,-0.412058127214172,-0.09724885276612144,0.7938764216691323,0.7443799184006451,0.7353119891587926,1.1117823665668116,1.0280785022510592,1.0309290992829008,0.8814889714592711,0.8791109981121865,0.859647692325862,0.551096315957741,1.0932648968848224,0.8317591041825942,1.1247034848504713,1.2563181198878473,1.161508859506162,0.21877034744128201,0.2162846825044718,-0.6669941473414126,0.43314107909142985,-1.4908728457260094,-1.4260986916912022,,,0.38174602146561804,0.356605896487982,0.15097243751040018,0,3.029099013873788
19,discussion_4.txt,"In line with what was described in our study regarding the benefits of having technical tools that support daily life, it seems relevant to advocate for the availability of getting CGM advice in the early postpartum period. This would be to assist the mothers adjustment to rapid changes in blood glucose levels, and especially to avoid hypoglycaemic episodes, as they interfere with taking care of the baby, including the childs security. The womens heightened awareness of the need for control, together with a reassuring effect of early alarms in case of a trend towards hypoglycaemia, might support these women in taking command of their diabetes. Fallon and Dunne (2015) claim that fundamental needs for women with type 1 diabetes are those related to safety and security. Since professional support is not available 24 h a day, particularly during early motherhood, technical devices can assist in continuously monitoring the unfamiliar and unpredictable blood glucose levels. This could be time and energy saving and might decrease the burden of daily self-management, potentially leading to better wellbeing and less exhaustion for these women. This is in line with what was found in a previous study by our research group (Berg & Sparud-Lundin, 2012; Berg et al., 2012).
Beyond technical devices for diabetes management, healthcare providers and peers could play a crucial role in supporting these women during early motherhood. The form of antenatal care provider has been found to influence the intention to breastfeed in women with diabetes (Finkelstein et al., 2013). For women in our study the frequent contacts with the antenatal care providers during pregnancy were abruptly interrupted when the child was born. Other healthcare professionals, either during the early postpartum care or after discharge, did not replace their supportive role. During a period of experiencing a more unfamiliar diabetes than ever before, and with reformulated incentives for taking care of themselves simultaneously with caring for the baby, most of the women in our study felt left with the responsibility. As the healthcare system did not support them sufficiently during early motherhood, they searched for support from other women in similar conditions. This is in line with the findings of Edwards et al. (2016), who made an extensive qualitative exploration of 200 electronic interactions between women with type 1 diabetes, from planning pregnancy, throughout pregnancy, and into early motherhood. The communication was retrieved from a free Internet-based counselling service and psychosocial support provided by a non-profit organization mainly for people with diabetes. Diabetes-specific distress was most frequent during contemplation, for example, when considering pregnancy, followed closely by the phase of motherhood. Depressed mood peaked during motherhood, and partners were not always able to understand their experiences. The authors conclude that contacts with other women who have experiences of pregnancy and motherhood seem to offer assurance not provided by their healthcare providers (Edwards et al., 2016). Although healthcare providers can assist in advising on how to make adjustments in insulin doses and so forth in order to balance the juggling of blood glucose, peers with diabetes are more likely to help prioritize the dual role in early motherhood.
Although the findings in this study resonate with other research, and by that demonstrate transferability, some limitations need to be acknowledged. First, the question of selection bias is always present in research studies. However, the effort to achieve a INTERNATIONAL JOURNAL OF QUALITATIVE STUDIES ON HEALTH AND WELL-BEING 7 varied sample of women with type 1 diabetes with respect to experiences both of being a first-time mother and of having given birth earlier increases external validity. Second, socioeconomic differences regarding educational levels, social welfare systems (for paid parental leave) and healthcare systems, as well as varying sociocultural attitudes towards breastfeeding, can have an impact on the transferability of the findings to other societies.
Having diabetes and being in the early period after giving birth to a child is demanding and challenging. The healthcare system needs to support these women, especially first-time mothers. After the extraordinary health care provided during pregnancy, it would be highly relevant and important to at least phase out the frequent support more gradually after the childbirth, not least because of the new challenges faced in relation to diabetes management in early motherhood. Therefore, we propose that a woman with type 1 diabetes should have planned and frequent contacts with her diabetes nurse directly after childbirth, preferably arranged beforehand. To secure the diabetes management support, telephone follow-up once or twice a week could be relevant during this extra-demanding period, as well as accessibility to technical support for facilitating daily self-management, if wanted. Moreover, providing these women with alternative sources for health information and peer support beyond the antenatal and diabetes care has the potential to improve their life situation during motherhood. This needs to be further investigated in upcoming studies.",4,34,26.852941176470587,0,0.40171803830360825,0.35059982095087616,0.3880604372659166,0.37073397080641285,0.08823529411764706,0.3590489395788782,0.3591886650486223,0.3667114363714705,0.33856509494603115,0.21589661192237622,0.20869328223262765,0.20344731489013113,0.21793305985479852,0.16112494256492693,1.3823018639042364,0.2735902147353144,0.16147383506296292,1.374284294770015,0.2742460685421984,0.15757282962061292,1.3578205183401584,0.26861423259645156,0.16020344847998527,1.3668205925008587,0.2718986379082413,0.01961904761904762,0.03949420677361854,0.047619047619047616,0.038375350140056025,3.031351305378979,3.4679692374149864,0,0,1.2371613422697014,6.890069553478559,9.234457134961206,-0.8189859542883079,1.382601341379084,0.043232540474406014,,-1.1219400959061678,-0.36554532198883555,0.4607194644595526,0.45250073682217795,-0.14898145372288754,-1.0512078878971498,-0.914668612747841,0.32840835511262784,-0.5862261164705295,-0.6731708521690274,-0.1743478821234733,0.2489238824322478,0.08741216794616491,0.7085193787865224,0.8194282844330222,0.7428227065398378,0.5199555121382512,0.6567875139391788,0.5743653886887612,-0.26152710074664504,0.121953511963052,-0.23197388786391157,0.05057792560275781,0.34025552943114235,0.0695816241153934,-0.40438669889965656,0.1552598098975384,0.2701021629215498,0.5401305182999059,-0.5807362821306851,-0.4924627663359859,,,1.8081114548058195,1.6604121432871224,1.6287934729635338,0,-2.066217417432828
20,discussion_5.txt,"Third, at Adams, and at almost all positive outlier schools in LSES-III, there was a prominent display of the names of academic honor roll students in a heavily traveled hall near the principal's office. Academic excellence was the single most important goal of the school. Of central interest in LSES-III, the school's commitment to academics had been translated into in-class action. The rate of interactive instructing at Adams nearly doubled that at Fillmore. Similarly, time spent in organizing and off-task activities was a third lower at Adams.
If a rational, data based school improvement literature is to develop, it will require information from both the school-effectiveness and teacher-effectiveness literatures. Good and Brophy (1986) have argued for research which nests classroom interaction studies within larger school effectiveness studies. Such research can provide a bridge between the school effectiveness and more devel oped teacher effectiveness literatures. LSES-III is one such study. We are just beginning the analysis of data from this phase, yet the first preliminary analyses presented here indicate that the method offers promise. If further analyses confirm our findings in the 16 school database, and if other studies replicate.
LSES-III findings, then connections will have been built between the ""process"" of the two fields, and substantial progress will have been made toward the development of a more unified model of effective schooling.
Given that practice cannot wait on theory development, practical issues should be addressed. To date, the quasi-experimental teacher effectiveness literature is much more developed than similar efforts in the school effectiveness field. The preliminary findings of LSES-III suggest that school ""culture"" and other school level variables are translated in effective schools into specific, measurable teacher behaviors. In several studies (e.g., Anderson, Evertson, and Brophy, 1979; Good and Grouws, 1979; Stallings, 1980) these teacher behaviors have proven alterable through extensive, specific, behaviorally based workshops series. Future school improvement studies might find added strength in in-depth efforts to change patterns of classroom interaction.",4,17,23.352941176470587,0,0.48325808346271515,0.34945214594549995,0.32240157965570687,0.29479106043775877,0.29411764705882354,0.37976139245761764,0.3682146726457018,0.37358314461413433,0.5001619764885894,0.20226107758504372,0.20577172182559494,0.19134574640316493,0.25342086110019474,0.12842765930468905,1.1275457602463606,0.22588612176417397,0.1526131326287612,1.3161208343055941,0.26078650965511285,0.14635714004085812,1.2751763642007612,0.25827758117771893,0.14870792304616212,1.2824530060248758,0.25796202855004574,0.022727272727272728,0.25757575757575757,0.07407407407407407,0.023809523809523808,3.0333894400686225,3.4295612408442477,0,0,1.084204335131937,6.735099793189645,8.661683160220754,-0.8189859542883079,-0.7977532786064844,-0.7126163157617902,,-0.520028919404676,-0.374959704482053,-0.01616685691901842,-0.1376935784520678,0.9923142446255352,-0.5845940864211698,-0.6185949135802102,0.38145808886065613,2.433447825900408,-1.0652661864974726,-0.29568461940823143,0.09368172970282546,1.153017950897938,0.042447424283499305,0.18242825055094924,0.15690441816881473,0.07509724785631502,0.28023589368092494,0.14698950336792804,-1.2708189421394736,-1.3810219365183416,-1.0200822106547927,-1.2062635551071488,-1.2701433516205605,-1.1167293928739228,-0.3066881562241793,6.695445886457647,0.9894892293860462,-0.5236949394473158,-0.5624207778451661,-0.9006485372235312,,,-1.37016712936946,1.161926648933804,-0.5527144162813378,0,5.9520226006655506
21,discussion_6.txt,"It is acknowledged that the small sample size limits its generalizability. The study aimed to gather similar numbers of both male and female athletes to ensure both populations were represented. However, gaining an equal number of participants depending on type of sport (e.g., individual vs team, closed vs open skills) was not a priority. In this study, one athlete participated in a team sport and there was evidence that counterfactuals would be influenced by contextual factors such as being part of a group. For example, a team athlete might experience more counterfactuals directed at others behaviors that influence outcome. This might be seen as less controllable and might influence the consequences associated with the counterfactuals experienced. Future research might aim to explore these differences and the possible gender differences in the generation and experience of counterfactuals and their perceived consequences regarding elite athletes.
In using semistructured interviews to explore athletes counterfactuals, it is plausible that memory decay and poor reconstructive processes may have influenced participants responses (Brewer, Van Raalte, Linder, & Van Raalte 1991; Smith, Leffingwell, & Ptacek, 1999). Reporting on significant past events or capturing in the moment counterfactual thoughts, think out load protocols could be applied in future (Nicholls & Polman, 2008). However, both think out loud and semistructured interview protocols are researcher prompted. Alternative methods such as archival methods might be used to capture self-generated counterfactuals.
Despite the limitations, the use of currently competing elite athletes provided ecologically validity to the representation of counterfactuals experienced and their perceived consequences. Findings from this study could be of value for those in the applied settings working with both elite athletes and less experienced athletes. Upward counterfactuals present themselves when performance does not reach a certain level set by expectations or goals. It is therefore important to monitor each athletes expectations and ensure the athletes goals are flexible to alleviate negative emotional consequences that could be debilitative to performance or motivation. This may be shaped by the cultural environment and their goals. Goals around process and development may lead to an assimilation effect where motivation and performance can be enhanced. In relation to the REM (Markman & McMullen, 2003), upward counterfactual thoughts would be best used in a reflective process following an event to inform goals and intention for future practice and competitive behavior change. These could also be useful for significant others (e.g., coaches, physiotherapist, support staff) to inform how they might deal with issues brought up by the athlete that they might influence. For example, if there is conflict between two athletes then a coach might use each athletes counterfactuals using reflective practice to come up with a management strategy to overcome the issue. In addition, counterfactuals could be used to gain perspective on these goals and protect an athletes self-esteem following failure (McCrea, 2008). Beyond the scope of elite athletes, individuals who participate in performance related activities (e.g., business, sport & exercise practitioners, health services) would benefit from lessons learned from elite athletes to understand and suitably use counterfactuals to facilitate cognitive, emotional and behavioral change to enhance their practice.
This study taps into the experiences elite athletes have of counterfactuals. It also provides an insight into how elite athletes cope with the negatives effects of counterfactuals as well as use the positive effects of counterfactuals to improve and sustain high performance. Future research on elite athletes counterfactual thoughts using experimental and longitudinal studies would be beneficial to investigate the antecedents and consequences of counterfactual thinking on training and performance. The use of an elite population could be a useful source for understanding high performance athletes and how they experience thoughts, emotions and behaviors. By understanding how elite athletes generate, experience and reflect on counterfactuals, it is hoped other athletes can use counterfactuals to identify causal inferences and deploy accompanying changes to enhance both performance and motivation to succeed making sport more fulfilling and enjoyable.",4,27,26.88888888888889,0,0.5744251012802124,0.4716548443774552,0.5377430806557337,0.5289658009360879,0.037037037037037035,0.4167240566128622,0.38990755943392497,0.40218356939928,0.3924112272971634,0.2378987030774031,0.2292216536772924,0.2184575239673329,0.23630306982371868,0.17721757200152702,1.4522869771955806,0.2918330257945996,0.17572032168783386,1.4525150851810469,0.2916817492269532,0.17686872428627087,1.4588028739498717,0.29361897915352325,0.17614137954650377,1.45711836278801,0.2927438003675821,0.057789855072463765,0.048238070606491656,0.021739130434782608,0.035530621785881254,2.9041320849067316,3.3700521555825924,0,0,1.1495128095418794,5.891584793892379,8.166686728660357,-0.8189859542883079,0.4848082625614971,0.05099569399317216,,0.1529465105891045,0.6274695018284986,1.5478782695084357,1.682207712557475,-0.4327957279153525,0.24810734856253003,0.09298140274064227,0.6022539763391865,0.4199675749303092,-0.04049177455226703,0.6782258339185839,0.4414788535149833,0.6390154842632755,1.0363401661167024,0.9944212243379924,0.966887267150994,1.2352111432937367,1.1632555034319583,1.1279934482211016,1.4748965867971167,1.9584294586490925,1.6744896342774798,1.7931214044903971,2.0638490836130874,1.8439619802603398,0.7954080814322314,0.4174850934428595,-0.4336460542719793,0.3323637651564267,-1.7239797535262036,-1.533088758301021,,,-0.013128772863650901,-1.5513768409549502,-2.4379931967747877,0,7.617975836812358
