43,editorials_43.txt,"The news that an Uber self-driving vehicle has killed a pedestrian in the US has made headlines around the world.
It's a reminder that the era of self-driving cars is fast approaching. Decades of research into advanced sensors, mapping, navigation and control methods have now come to fruition and autonomous cars are starting to hit the roads in pilot trials.
But partial or full autonomy raises the question of who is to blame in the case of an accident involving a self-driving car.
In conventional (human-driven) cars, the answer is usually simple: the driver is responsible because they are in control. When it comes to autonomous vehicles, it isn't so clear cut.
We propose a blockchain-based framework that uses sensor data to ascertain liability in accidents involving self-driving cars.
Uber has suspended self-driving car tests as US authorities gather data about the circumstances surrounding the accident, which involved a car moving in autonomous mode with an operator behind the wheel.
For partially autonomous vehicles, which still involve human control, assigning liability depends on what action led to the collision and whether it was based on decisions by the driver or the vehicle. For fully autonomous vehicles, the blame can be assigned to, or shared by, one of many parties including the manufacturer, the service centre and the vehicle owner.
Manufacturers could be liable in the case of a design fault, the software provider for buggy system software, or the service centre for inadequate service to the vehicle. On the other hand, negligence liability might fall to the owner for failing to implement a software update from the manufacturer, or with the manufacturer if the accident could have been prevented by a human driver.
In this complex web of potentially responsible parties, how can the circumstances surrounding an accident be determined?",9,13,26.76923076923077,0,0.7595593507091204,0.5700396457925822,0.2616996169090271,0.2616996169090271,0.15384615384615385,0.28285426418296994,0.3102002114915039,0.10777029985630954,0.25923571362500153,0.21806818908080458,0.20725007682993282,0.08443662780854437,0.1996303552209779,0.05107618086862774,0.4427434537497369,0.08723959840120102,0.16498283356239607,1.4000060769529954,0.27824311909681065,0.16512332284856546,1.3966636136923483,0.2780123142154186,0.1652061293679455,1.393454726781734,0.2774477416938302,0.007407407407407408,0.003968253968253968,0.025,0.03536585365853658,3.148586416221198,3.5143115117912167,0,0,1.1326837822671156,6.534221430832331,9.079812009392098,0.3645197600011544,-1.3107778950736768,0.025154707455182636,,1.5195679499939485,1.4345204070955582,-0.45705079502490875,-0.39486546928517774,0.21472816443210432,-2.7677350103418004,-2.5216019667426646,-1.6706227247075052,-2.0686115644621927,-0.6107262679753027,-0.23428634321885103,-1.2777769977265432,-0.4621701453279665,-1.5332691273194172,-1.5298725978977714,-1.5460004815548054,0.6961274345583478,0.8233109408397491,0.701282105185956,0.41793635616109354,0.8283582088868331,0.48457405809401216,0.5975365566752621,0.8486448509143695,0.5419320205473646,-0.7882261605903121,-0.9101505425122354,-0.34497377890559455,0.3203298081040091,0.47278593401852353,4.55308907208316e-05,,,-0.3628174728504955,0.515768652832592,1.0398009971529074,0,-4.62383653205797
44,editorials_45.txt,"Human rights lawyer Yu Wensheng did the unthinkable in Xi Jinping's China. In an open letter, last October he criticised the President's ""totalitarian rule"" and called for immediate political reform and democracy.
The next day, as he was walking his son to school, he was detained by a squad of security police and man-handled into a van. His wife, Xu Yan, hasn't seen him since.
""I am very worried about Yu Wensheng, he acted within the laws and did what he thought was right but he lost his freedom,"" she said.
""I've run around to different departments but no-one can tell me what's happening. I can't see any hope for the future.""
From today, the National People's Congress has handed Mr Xi a powerful new weapon to deal with any dissent or opposition, even before it surfaces.
It can overrule the highest courts in the land and is only answerable to the cabinet and, of course, Xi Jinping.
Xi now controls Communist Party
People in China are bracing themselves for another round of repression.
Mr Xi has already targeted human rights lawyers, NGOs, the media, academics and he's now tipped to go further.
It is not surprising that the Congress will approve a domestic security budget that is a whopping $320 billion 20 per cent more than the national defence budget.
Mr Xi has put a bigger priority on fighting the enemy within rather than abroad.
The end of the 13th National People's Congress means Mr Xi's remaking of the Chinese political system is complete. China now has a much more centralised structure of governance answerable to him, collective leadership with an emphasis on consensus has been discarded.
Professor Stein Ringen from Oxford University, author of The Perfect Dictatorship China in the 21st Century, says the curtain has been pulled aside and Mr Xi has finally revealed his true nature:
""It's been extraordinary and rapid how he has amassed power. He's moved from being a cautious leader to a very adventurous one showing off power.
""He can launch policies on his own without any process and no safeguards. This is now a system with more instability than it had two to three months ago.""
Professor Ringen says at the same time there's also been a dramatic shift in how an emboldened Mr Xi is projecting China's power and influence overseas.
""We are now hearing from Xi Jinping that the Chinese model is one for others, one that they can learn from. This is an entirely new direction. And for many developing nations the model is attractive for its ability to deliver growth while democracy dithers,"" he says.
Susan Shirk, a former China advisor to US President Bill Clinton and now a professor at the University of California, says this is a turning point for China and is a direct challenge to America and the democratic world.
""Xi Jinping has thrown down the political gauntlet and is ready to compete. This is something previous Chinese leaders didn't want to say because it would provoke a major reaction on the part of democratic countries because it reeks of cold war ideological competition,"" she says.
""For decades we've said the China-US relationship was different from US-Soviet relationship because we don't compete about political systems, but this is something very new.""",20,29,22.03448275862069,0,0.6931969507464341,0.43327744582236694,0.14578260965645312,0.14995855117837587,0.06896551724137931,0.4005934862868377,0.38579593565917075,0.1283040473703295,0.26635780496478434,0.21967788865030916,0.17612278463682693,0.06595692501713832,0.13380327291697974,0.04838755644711989,0.41191066813548616,0.08229781378721604,0.11438806438465311,0.9770966624712573,0.19541418414820833,0.1556682990989332,1.3162076324723169,0.2629864130165595,0.1550313375565141,1.3186281713278534,0.2644121672820529,0.0,0.005714285714285714,0.05555555555555555,0.03636363636363636,3.1298349240918415,3.5385623361573044,0,0,1.1958222887339356,6.146111910157674,8.566456681821068,2.9682323314379713,0.7413205707950934,-0.9973463977980271,,1.0296949046815391,0.31265955354194747,-1.2989666794294739,-1.2632670285192973,-0.2558022333712621,-0.11528499245410762,-0.0418892637731935,-1.5121017572856217,-1.9355248772152984,-0.5644387023208186,-1.527048959432152,-1.514839560833765,-2.43878512614712,-1.5880387333782804,-1.6069678478209393,-1.6066972017351056,-1.844021200980801,-1.9146146222890328,-1.9287512934424376,-0.4329144330676763,-0.6348228922618813,-0.6610617297969833,-0.5149050172060129,-0.579635916726006,-0.5676811672816742,-1.0210577231409697,-0.8577876880083745,0.4859182828608987,0.39320357570894315,0.30427742660719537,0.25777418956466647,,,0.9491313335194306,-0.7326488830534389,-0.9154007865691233,0,-4.537649921043031
45,editorials_47.txt,"The Secretary of State fired, and then humiliated by the President's chief of staff. The National Security Adviser threatened with his own firing. A long-term law-enforcement official axed two days before he would have received a pension.
And a Twitter diatribe against a seasoned investigator who may very well hold his fate in his hands.
It's easy to look from afar at the nastiness of Donald Trump's administration and wonder why it is at such a fever pitch.
This is what it looks like when Mr Trump is in over his head, and there is no-one who can counsel him or calm him down.
Veteran political operatives, who might be able to be of assistance, are staying far away. Those who remain on staff never know when they will be bullied privately or criticised in public.
Incredibly, this could all get more chaotic before the dust settles.
On Sunday night, the New York Times reported Mr Trump now feels unshackled, and free to say whatever he likes.
Earlier on Sunday, he turned his wrath on Robert Mueller, the former Federal Bureau of Investigations director who is leading the investigation of Russian interference in the 2016 presidential election.
It was the first time he had mentioned Mr Mueller by name, and his Twitter tirade flummoxed legal experts who said Mr Trump was simply handing Mr Mueller ammunition.
The White House quickly issued a statement saying there was no discussion or consideration of firing Mr Mueller.
That may or may not be true. But the former FBI director is the person who Mr Trump fears most, and who fits the model of the kind of men he resented most during his turbulent days in the real estate game.
Mr Mueller is the ultimate establishment player, the ultimate upper-class Republican. Even his name sounds like what used to be called ""white shoe"" Robert Swan Mueller III.
He was appointed to his FBI position by George W Bush, himself a scion of an old-school Republican family. His original 10-year term was extended for two years by Mr Bush's successor, Barack Obama, making him the longest-serving FBI director since J Edgar Hoover.
His resume gleams with sterling credentials Princeton University and the University of Virginia. Service as an officer in the Marine Corps, where he was awarded a Bronze Star, among America's highest military honours, as well as a Purple Heart, given to soldiers wounded during action.
He has bounced between the private sector and public service, between San Francisco and Washington, Boston and New York.
Everything in his background is as much a contrast to Mr Trump's hustling, lying (by his own admission), adulterous (by his own admission) life.
When Mr Trump was rising in New York in the 1980s, the old money elite looked down on his arriviste persona.
Mr Trump, at the time, declared he didn't care, hanging his name from banners in full sight of city landmarks such as Grand Central Station, heading off to play golf at a country house before building his own golf courses.
And, as the Trump name appeared in more and more places, not just in New York, but across the United States and around the world, it seemed Mr Trump had triumphed over the old guard, which seemed to be less and less relevant as global billionaires became richer and richer.",19,26,24.692307692307693,0,0.7359116500616074,0.3734536561369896,0.12302510754058235,0.12116213352010961,0.0,0.44074582396927525,0.3891339954499176,0.11776915341615676,0.35798288540620554,0.21251615837721502,0.1811933784322066,0.05943551796178023,0.1948288139968849,0.03505271107905723,0.3036470555648421,0.06008028937562069,0.129353915967294,1.1064271380828943,0.22077745424628709,0.153209566728567,1.3135972983405815,0.2608323943718998,0.1527310524658218,1.3179261537383944,0.26168784389785316,0.0125,0.021052631578947368,0.03389830508474576,0.0192090395480226,3.2567724916833654,3.6556697040471593,0,0,1.1717256835045295,6.317908799928435,8.859179836719331,2.7315311885800786,0.356552108444699,-0.4233709874542085,,1.3450056807368544,-0.17807522385901217,-1.4642565102734864,-1.4870599002919156,-0.6381081815864973,0.789273971848031,0.0676067342812435,-1.593431362617633,-0.22337631818673448,-0.7703771684145744,-1.3164596778459505,-1.5984979123267158,-0.6063478603713468,-1.8596810727925202,-1.877673530179431,-1.8795805763956126,-1.092649308290163,-1.0773260608540995,-1.1234017196760588,-0.654173991290338,-0.6822947086678408,-0.8252928673805296,-0.7664023268404382,-0.5930359485126826,-0.7995808181545917,-0.628154461336735,-0.3977962962902469,-0.10300367154986693,-0.8596945706588728,1.4449898510752799,1.5023473385622281,,,0.44843034711108315,-0.1800361838656607,0.19948553846786457,0,-7.629284873926136
46,editorials_49.txt,"So, Vladimir Putin won his nation's presidential ""election"" race in a ""landslide"".
What a shock!
With no serious competitor and almost total control over the media, not even the Kremlin could suggest with a straight face this result was ever in doubt.
It is staggeringly easy to poke fun at a process with so many obvious democratic deficits.
The images of officials appearing to stuff ballot boxes in remote Russian regions are bizarre, not to mention the complaints from some citizens that they were forced to vote multiple times.
I find this particularly amusing considering how closely the ABC was supervised, monitored and checked when we entered a polling booth or filmed on the street.
Even an election coordinator in central Moscow confided to me in an awkward, embarrassed kind of way that ""irregularities"" and ""widespread voter fraud"" were fairly common.
It seems highly unlikely he was a Putin supporter they have spent the past 10 days claiming Russia's version of democracy is its own ""unique"" process that I can't comprehend due to my misguided, western ""Russophobic"" ways.
But to purely mock or focus on the broader geopolitical consequences of Vladimir Putin's ""re-election"" quote marks intended is to miss a few interesting aspects of this whole, theatrical process.
Russians, the many we met at least, seem to genuinely like voting, even though they almost all know the outcome has already been decided.
In their eyes, the fact they can actually cast a ballot puts them miles ahead of a stack of other countries.
Opposition supporters of course are campaigning for change.
But even had the banned and oft-arrested Alexei Navalny been allowed to run, it's highly unlikely he would have forced the election into a second round.
It's true, no-one knows for sure what would happen if Russia suddenly gave its people the freedom to openly, safely challenge the political establishment, though it's safe to say there's no sign that's about to happen.
And that seems at least partly because Mr Putin appears to have a solid support base.
Russians have repeatedly told us, ""they're not better off"", ""life isn't better"", but they think their President is carving out a greater place for them on the world stage and that makes them very proud.
So the ""election"", while flawed, serves a purpose it's almost a sort of ritual.
In the eyes of many Russians, the process, the show, legitimises Mr Putin's enormous power at home and licenses him to keep projecting it abroad.
Here, many expect him to keep antagonising and confronting Western nations for the next six years.",19,19,26.894736842105264,0,0.9783332943916321,0.9038904201217562,0.0,0.0,0.8947368421052632,0.4339000514612116,0.38202840238287045,0.0,0.25915160358960465,0.24879463395938792,0.20047017485001312,0.0,0.1616224026098558,0.0,0.0,0.0,0.10595897397367784,0.8677117245791064,0.17674160930508148,0.15991865285311652,1.3356893154244085,0.275107242722013,0.15290752160422233,1.3110749120518814,0.2609498234126749,0.0,0.11065162907268171,0.05172413793103448,0.014611338398597311,3.027139378741968,3.488953390484475,0,0,1.1192085046906068,5.842126080337107,8.664889386864246,2.7315311885800786,-0.541240970372888,0.052258599350291986,,3.134510418726499,4.173099595862843,-2.357799180792149,-2.4286777825002295,4.321808462363791,0.6350511981027639,-0.16547297471670092,-2.502611731142117,-2.070183283419609,0.2728251484446237,-0.5158657291434634,-2.360952611228986,-1.6034494773582333,-2.573735130227002,-2.6369220110038722,-2.6175076204565,-2.267210057343721,-2.6227753002516803,-2.5216539488524794,-0.050428154660496854,-0.28052691722286793,0.26307959828216854,-0.747108408134092,-0.7238116694575517,-0.8624025425660521,-1.0210577231409697,2.289244921671038,0.3817311904763855,-1.195490935305874,-0.6185863617954162,-0.26945106403810964,,,-0.6428189382208334,-1.7104688549757179,-0.5405029523777022,0,0.2441579898801015
47,editorials_5.txt,"The firing of Rex Tillerson occupied much of the news yesterday as shocked anchors recounted how the Secretary of State was effectively dispatched by a single Trump tweet. The shock, however, should not be over Twitter but torture. Once CIA Director Mike Pompeo replaces Tillerson, President Donald Trump wants Pompeo's second in command to take over the CIA: Deputy Director Gina Haspel.
Most people have no idea who Haspel is. She is, however, well-known to human rights advocates and civil libertarians around the world. Haspel was not simply a key figure in the torture program run by the Bush administration, she headed one of the infamous foreign black sites and was accused of knowingly destroying evidence of the torture carried out on her watch. 
After years of Congress and former Bush officials denouncing the torture program, the confirmation of Haspel would reaffirm that torture as not simply acceptable but a potential path to promotion in the United States. Trump has declared the possible confirmation of the agencys first female director as a historic milestone. Given her role in the torture program, however, Haspels confirmation would be equally historic and one milestone we would be wise to avoid.
The torture program approved by former president George W. Bush on Sept. 17, 2001, represented one of the most infamous moments in our history. The Justice Department memo used to justify the program was ultimately denounced by the Justice Departmentas seriously flawed and withdrawn. The program was ultimately closed as both Republicans and Democrats belatedly lined up to pledge to block any such program in the future. On Dec. 30, 2005, the Detainee Treatment Act was passed to reaffirm the long-established fact that waterboarding is torture and torture is a violation of not just international law but United States law.
The shocking accounts of the U.S. torture program destroyed the credibility of the United States and emboldened our enemies in China and other countries in their own use of torture. Among these shocking accounts, however, one CIA officer and one case stood out: Haspel and the torture of Abu Zubayda. Zubayda was the subject of one of the CIAs extraordinary rendition programs where suspects were taken to foreign locations were they were tortured. Haspel was the Chief of Base at the Thai torture site known as CIAs Cats Eye.
Zubayda was waterboarded 83 times in one month. He was denied sleep, forced into a small coffin-like box for long periods of time and physically abused, including having his head slammed into walls. The CIA reportedly got nothing from the torture but each session was carefully detailed by Haspel.
Accounts of the torture sessions describe fluid intake and involuntary leg, chest and arm spasms"" and ""hysterical pleas."" Zubaydah ""became completely unresponsive, with bubbles rising through his open, full mouth."" None of that mattered even when Zubaydah could no longer communicate and lost consciousness. There was only one person who could stop the sessions: chief of base Haspel ... and she didnt.",7,24,23.208333333333332,0,0.47739966764398245,0.3038362378483989,0.3285528621858075,0.36440395120353924,0.0,0.4370286788369687,0.41512546396930133,0.46162330146223585,0.41958266580713316,0.22770433402005233,0.19511969223492248,0.19740169736246269,0.20366948128647203,0.14872144568000997,1.2934613181151893,0.25605862114333705,0.15439678970503892,1.3334632496004548,0.2647937934131102,0.15237003804811747,1.3212658043584646,0.262145995720711,0.15397775610827016,1.3251080588457713,0.26314485400979926,0.013888888888888888,0.02414965986394558,0.0,0.01885369532428356,3.120053404452129,3.5480503296208656,0,0,1.0938975946686411,6.500308591881001,9.258751124199874,-0.10888252571463052,0.1000398002111027,-0.743845365144098,,-0.56327449219051,-0.7491471744451124,0.02851047382217019,0.4033066571239554,-0.6381081815864973,0.7055334689255668,0.9201863658143389,1.0611299717454743,0.9277056207519516,-0.3336350020138955,-0.7380792085742349,0.1713690860779727,-0.34088576189437364,0.4558494139134624,0.5972886384533357,0.52749356662637,0.16464709979179404,0.39251110093868397,0.2742311505997086,-0.729722573637205,-0.5428344359912056,-0.7251385607400561,-0.6300963475268756,-0.45594856185345006,-0.6755573126345743,-0.5844985433584867,-0.30491754889618045,-1.0247945567145438,-0.8856473880891218,0.216376727114482,0.3586090227215275,,,-1.1687518442978089,0.4066824784843716,1.72132129636787,0,1.4996350846880548
48,editorials_7.txt,"When we see the initials GOP, we think of the Republican nickname Grand Old Party. With Larry Kudlows appointment as the new director of the National Economic Council, those initials might soon become an acronym for Growth, Opportunity, and Prosperity.
Since his days working in Ronald Reagans budget office, Kudlow has been the happy warrior fighting for policies that would enable all of us to have better lives. He played an indispensable role in devising the 40th presidents economic revival program of promoting tax cuts, battling inflation, cutting regulations and reducing trade barriers. Not for him the pessimism of those who think were headed for long-term stagnation and or the defeatist thinking of those who believe we must go through austerity and grim times before we can ever prosper again.
Tax Cuts. Unlike all too many economists, Kudlow knows that taxes impose a financial burden on labor. They create a disincentive to hard work and risk-taking that is so critical to achieving success. Lower that burden through reductions in tax rates and we get more prosperity. Larry co-authored a book JFK and the Reagan Revolution: A Secret History of American Prosperity that chronicles how President John Kennedys historic, growth-igniting tax cuts came into being. The result was one of historys greatest economic booms.
We saw the same economic miracle materialize as a result of Ronald Reagans tax cuts tax cuts that Kudlow was instrumental in formulating and implementing.
Last year, Kudlow had another crucial hand in making tax cuts a reality this time advocating President Donald Trump's cuts. The historic bill that the president signed in December already is ginning up the kind of positive economic activity we havent seen in a generation.
Critics carp that that these tax reductions and Kudlow will be pushing hard to help make a reality President Trumps stated desire for more cuts are bad because they mean more budgetary red ink. Short-term, of course they do: new investments rarely bear fruit overnight! But Kudlow knows and history shows hes right that the only way we get some sanity in Washingtons finances is when the economy is booming.
Cutting unnecessary regulations. The cost to the US economy from rules and regulations comes to some $2 trillion. The president has made more progress in reducing these burdens than any other president in his first year in office. Kudlow will work hard to do more of the same.
Technology. Closely related to the subject of deregulation is making sure government doesnt hobble the development of exciting new technologies. One example is the deployment of next generation 5G broadband. This is a technology that has the potential to make possible billions upon billions of dollars in new economic activity. Nearly all of the investment will be made by the private sector, but government help is needed to clear red tape and minimize state and local regulatory roadblocks for the sake of national economic progress. Kudlow will be an advocate for just that policy.",8,27,20.444444444444443,0,0.47990229152716124,0.3111013406635583,0.3037504218518734,0.31248320583254097,0.1111111111111111,0.42195048419729114,0.3495542982298156,0.353467837959114,0.37785603415914004,0.2352274880700168,0.18819981172915534,0.19646086409205088,0.20858716377426345,0.1532688394513131,1.310521095993121,0.25862573059613025,0.1545158423187136,1.3398312945484445,0.2645370005839855,0.15609099432513446,1.3524819057240491,0.26727828429276024,0.15570537919879854,1.3478059297271854,0.2655000340070452,0.10092592592592592,0.06233072483072483,0.03389830508474576,0.0480225988700565,3.0327274611957904,3.4478796738287354,0,0,1.10846369780796,6.396770115483012,8.872359827562208,0.12781861714326193,0.4848082625614971,-1.3407260095528404,,-0.5448006578564039,-0.6895515080464693,-0.1516319313698159,-0.000198141599336907,-0.02217082057306287,0.36584923348493636,-1.2306978862114417,0.22616749376765125,0.14798251540742385,-0.11730364825469382,-1.0254721103088826,0.15929982560025033,-0.1932206286990331,0.5484837601079083,0.6399454342287064,0.5590236992200579,0.17062422626351886,0.43373797471641823,0.266077312601606,-0.3948763935724759,0.02486493050777647,-0.3338320171851173,-0.44120995205863767,-0.022694187792498117,-0.4750798574720174,2.1512723166117405,0.840118647726085,-0.10300367154986693,1.2447241721924591,-0.5683695882667188,-0.7059671073954114,,,-0.8660842220103979,0.07363409216940085,0.24968379340244065,0,2.3498373188259705
