,d_id,text,DESPC,DESSC,MSL,CoREF,PCREF_1,PCREF_a,PCREF_1p,PCREF_ap,PCDC,SMCAUSe_1,SMCAUSe_a,SMCAUSe_1p,SMCAUSe_ap,SMCAUSf_1,SMCAUSf_a,SMCAUSf_1p,SMCAUSf_ap,SMCAUSwn_1p_path,SMCAUSwn_1p_lch,SMCAUSwn_1p_wup,SMCAUSwn_ap_path,SMCAUSwn_ap_lch,SMCAUSwn_ap_wup,SMCAUSwn_1_path,SMCAUSwn_1_lch,SMCAUSwn_1_wup,SMCAUSwn_a_path,SMCAUSwn_a_lch,SMCAUSwn_a_wup,SMCAUSwn_1p_binary,SMCAUSwn_ap_binary,SMCAUSwn_1_binary,SMCAUSwn_a_binary,PCCNC_megahr,WRDIMGc_megahr,PCCNC_mrc,WRDIMGc_mrc,WRDHYPnv,WRDHYPnv_fixed,WRDICnv,zDESPC,zDESSC,zMSL,zCoREF,zPCREF_1,zPCREF_a,zPCREF_1p,zPCREF_ap,zPCDC,zSMCAUSe_1,zSMCAUSe_a,zSMCAUSe_1p,zSMCAUSe_ap,zSMCAUSf_1,zSMCAUSf_a,zSMCAUSf_1p,zSMCAUSf_ap,zSMCAUSwn_1p_path,zSMCAUSwn_1p_lch,zSMCAUSwn_1p_wup,zSMCAUSwn_ap_path,zSMCAUSwn_ap_lch,zSMCAUSwn_ap_wup,zSMCAUSwn_1_path,zSMCAUSwn_1_lch,zSMCAUSwn_1_wup,zSMCAUSwn_a_path,zSMCAUSwn_a_lch,zSMCAUSwn_a_wup,zSMCAUSwn_1p_binary,zSMCAUSwn_ap_binary,zSMCAUSwn_1_binary,zSMCAUSwn_a_binary,zPCCNC_megahr,zWRDIMGc_megahr,zPCCNC_mrc,zWRDIMGc_mrc,zWRDHYPnv,zWRDHYPnv_fixed,zWRDICnv,zero,gis
0,discussion_0.txt,"A third feature of our data that may constrain unified accounts of modality effects is that the magnitude of modality differences is greatest when participants initiate their recall from the start of the list. This suggests that a major factor in determining the modality effect in both IFR and ISR is the greater resistance to output interference observed with auditory stimuli (including visual words that are read aloud) relative to words in the visual silent presentation condition (Cowan et al., 2002, 2004). One explanation for the resilience of auditory items within our data sets is that auditory words are stored with more enriched sets of features than visual items (e.g., Nairne, 1990; Neath, 2000), and that recalled list items interfere with the recall of as yet to-be-remembered items. If we further assume that the internalized voice that accompanies silent written recall at output is more similar to the internalized voice that accompanies covert phonological recoding in the visual silent presentation condition, then as recall progresses the differences in the effect of subsequent recalls (output interference) on visual relative to auditory yet-to-be-recalled items will increase.
A fourth and final feature of our data that may constrain unified accounts of IFR and ISR is the confirmation of inverse modality effects (Beaman, 2002; Macken et al., 2016): visual recall advantages that occur in early mid serial positions with medium to long list lengths. Consistent with Macken et al. (2016), we assume that the modality of presentation affects the way that all the list items are processed. We agree that presenting stimuli in the visual silent conditions may be more conducive to cumulative forward-ordered rehearsal than visual read aloud as the former but not the latter is unimpeded by the need to articulate or vocalize each currently presented item. We are also willing to accept that participants might either feel a greater necessity to rehearse the visual silent items relative to the words in the auditory condition in order to form groups or subsequences of lists and/or be less able to incorporate the current auditory presented word into a cumulatively expanding rehearsal set. The benefits of cumulative forwardordered rehearsal may be greatest not at the start of the list but at early mid list positions (see Grenfell-Essam et al., 2013), and the benefit may be greatest at longer list lengths, where there might be both greater rehearsal opportunities and where the difficulty in recalling unrehearsed early list items might be more difficult (see Ward, 2002). Currently, many contemporary accounts of IFR and ISR (e.g., the SIMPLE model, Brown et al., 2007; the feature model, e.g., Nairne, 1990; Neath, 2000; and the Farrell, 2012 model) do not incorporate an account of rehearsal. However, our data suggest that recall of read aloud stimuli is reasonably similar to the recall of auditory stimuli, and we do not find the lowered levels of overall performance observed in the read aloud conditions of Macken et al. (2016). Of course, there are many differences between the methodologies used in our study and that of Macken et al. (2016). Most notably, we used different tasks, an experiment-unique set of stimuli, words rather than consonants and a rate of presentation of one word per second that was slightly slower than that standardly used by Macken et al. (2016; 750 ms per word).
Our preferred explanation of our data is that the modality of presentation affects the processing of the entire list of items. We assume that longer lists are parsed into multiple groups (of varying sizes), and the presentation of each auditory (or read aloud) item leads to a set of more richly encoded features than those encoded following the presentation of each visual silent item. The modality of presentation does not affect the PFR, as each item within the same modality in the list is encoded with the same richness of features. However, the encoding of relatively impoverished written recalled items will create greater relative interference for the impoverished visual items than the richly encoded auditory items, leading to improved recall of auditory over visual items on later recalls. We finally assume that participants might rehearse in a cumulative forward-ordered manner with all lists, but they may be able to rehearse longer sequences of early lists items with visual silent lists than with either auditory or read aloud lists.
In summary, we have reported a systematic exploration of the modality effects across a wide range of list lengths in both IFR and ISR, contrasting visual silent presentation with both auditory (Experiment 1) and read aloud (Experiment 2) presentation. We have shown that the magnitude and extent of modality effects are similar across tasks when the list length is controlled, and we have also shown inverse modality effects in both tasks in early mid list positions for medium to long lists. We believe these findings encourage attempts to provide a unified account of both IFR and ISR. We believe that in both tasks, modality effects arise through the greater resilience of auditory items to output interference. Our data provide four findings that will constrain the development of such a theory, and additionally provide a rich data set that could be used to model the development of the serial position curve with each successively presented list item.",4,31,32.25806451612903,0,0.36749239268247036,0.3472302317419039,0.3628186311533985,0.3988527398294537,0.1935483870967742,0.3579120067069712,0.36473547164996467,0.4145095968793832,0.3688046096338805,0.22003514601079666,0.21042938349699292,0.27747268734953157,0.21761166405132976,0.17435830905365424,1.3801763753213148,0.2836695860431303,0.15949921733682623,1.3200220332829218,0.26703349774702717,0.16391724211336894,1.338156773789828,0.27171461354902027,0.15438516720558368,1.3143582830909883,0.26291538179234447,0.10445686210992333,0.04296980889129845,0.054945054945054944,0.028428093645484948,2.974170760676655,3.4254520394971375,0,0,1.0637094446771866,6.032281007522943,8.881720528970199,-0.8189859542883079,0.9978328790286897,1.210505767359093,,-1.3745864929267295,-0.3931860752592999,0.27738590520983925,0.6710272266465418,0.4348149634046466,-1.0768209127035,-0.7327206660656056,0.6974111705766524,-0.021156582571179038,-0.5541656216526027,-0.10224502143746894,1.1985411315988945,0.0777614932136136,0.9780945056142696,0.8141136470999152,0.8666210562559565,0.4208183364128991,0.3054923482338857,0.3453475690941584,0.3094020179522148,-0.23565345482260977,0.004411759050096755,-0.5855528275500884,-0.6611390570442458,-0.6950904295256992,2.262257624124955,0.25949184829833105,0.46931704286556425,-0.18637441547678577,-1.0945838295304278,-0.9443195867278473,,,-1.7960284392647496,-1.0988045360451604,0.28533562967808496,0,5.527259366189368
1,discussion_1.txt,"Finally, in contrast to these two views, which both assume that it is the timing of the events that drives the observed spacing effect, we must consider an alternative view that this effect is instead driven by differences in contextual variation between massed and spaced exposures. This account proposes that spacing benefits can be explained by an encoding variability mechanism (Maddox, 2016). According to Mensink and Raaijmakers (1989) and Raaijmakers (2003), the general context surrounding a stimulus naturally fluctuates over time and this context is encoded with each presentation of a stimulus. As the temporal spacing of repetitions gets longer, the natural context is more likely to vary and that variation between stimulus encodings increases the likelihood/ magnitude of learning from that stimulus. Hence, this account would suggest that the spacing benefit arises due to the increase in different encoded contexts for the spaced word-meaning exposures, which would subsequently make the meaning more available. This model is akin to the concept of contextual diversity (Adelman, Brown, & Quesada, 2006; van Heuven, Mandera, Keuleers, & Brysbaert, 2014), which has been shown to affect word processing (lexical decision performance is better explained by contextual diversity across word occurrences than by just the frequency of occurrence). Similarly, the One Sense per Discourse principle (e.g., Gale et al., 1992) is based on the finding that an ambiguous word encountered multiple times within a discourse is highly likely to be used in the same meaning across those encounters, and suggests that an interlocutor would treat one subordinate repetition and three subordinate repetitions within the same discourse/paragraph as equivalents because they both provide one overall piece of evidence about one meaning (as opposed to multiple separate/spaced pieces of evidence of that one meaning).
However, we believe that this encoding variability/contextual diversity/One Sense per Discourse type of account is less likely to provide an explanation for the current data. Although this account can explain the observed boost for spaced presentations compared to massed presentations, it cannot explain why three massed repetitions did not boost priming compared to one repetition, given that in Experiments 2 and 3 its two additional repetitions were presented in three separate sentences that did not link together into a coherent discourse. Even in the massed condition, these three sentences proRETUNING OF LEXICAL-SEMANTIC REPRESENTATIONS 17 vided different contextual information and were distinctly presented in separate pieces of discourse (each sentence was followed by the judgment of relatedness of a probe word, and the sentences were unrelated) so this should provide enough contextual variation to see an increase in priming (compared with one repetition) even for the massed condition and even though the overall situational context did not vary a great deal. Yet, the massed condition provided no additional priming compared to one repetition, despite its two additional and distinct sentences/discourses of varying contextual information. While contextual variation accounts consider the general surrounding context rather than context within the sentence, it seems unlikely that additional sentential context would not boost priming if context were such an integral factor in priming. This makes the contextual variation account an unlikely explanation for the present findings. Clearly, it seems that there are several possible mechanisms underlying the spacing benefit but, as aforementioned, this requires further research to disentangle.
Importantly, the observed lack of benefit for multiple massed repetitions is likely to be advantageous from a communication point of view, as these instances are not always representative of the broader word usage. For instance, a conversation with a tree surgeon might involve the tree meaning of bark multiple times in a short passage/ time-frame of perhaps minutes. If meaning preferences updated cumulatively with each of these repetitions, then this conversation alone would have a disproportionately large effect on meaning preferences for bark compared with hearing the same number of tree bark repetitions over a longer time-frame of perhaps days or weeks. In this case, the overly sensitive change in meaning preferences would be inefficient. In contrast, if additional word-meaning repetitions only alter representations when sufficiently spaced, lexical-semantic representations might still be somewhat sensitive to the listeners immediate environment but would primarily reflect the listeners long-term, temporally distributed (spaced) experience with word usage, which are more likely to accurately predict how these words are used in the future. Under this account, exposure to multiple instances of a word used with its low-frequency meaning would produce a smaller biasing effect on its lexical-semantic representation, and therefore this representation would more likely generalise to future encounters.
Adults lexical-semantic representations are updated dynamically in response to ongoing experience to reflect the most likely meaning of words. The present studies investigated the changes that occur as a consequence of exposure to the meanings of an ambiguous word. The results replicate the word-meaning priming effect and go further in showing that multiple subordinate repetitions provided an additional boost to priming compared with one repetition when these encounters were spaced, although this boost was eliminated when multiple repetitions were massed, at least in a word association test. Moreover, one repetition of the dominant meaning reduced, but did not eliminate, the effect of prior subordinate meaning priming. These results indicate that the experience-based changes to lexical-semantic representations are not solely based on the most recent encounter with a word meaning, nor does the effect occur with the same magnitude across repeated encounters. Rather, word-meaning interpretation appears to reflect the accumulation of recent experiences with wordmeanings, where the temporal spacing of multiple encounters is key to producing additional learning effects. This seems to provide a balance among the influences of word usage patterns across a range of timescales, such that listeners can dynamically retune and update their lexical-semantic representations in response to recent experience while maintaining their longer-term knowledge of word-meaning dominance.",4,28,39.25,0,0.6114801510616585,0.4854344418715863,0.586135013614382,0.534283347800374,0.21428571428571427,0.381022319784043,0.3612738277272645,0.3623199280771789,0.36521768834659873,0.20855322402591506,0.21092910298514658,0.2182653987636752,0.21094741269769862,0.15849635123591002,1.3522514985463538,0.26952161628274285,0.1587907050480839,1.342073998178671,0.27001591301645234,0.15430553018391252,1.3217212047362872,0.2637464310758337,0.15863435525120484,1.3372644100350202,0.26911802780411137,0.021708152958152958,0.026242567915955015,0.02857142857142857,0.025696316262354,2.8883673243326666,3.3335856188257207,0,0,1.0896307421040041,6.1411513143083045,8.838688907135712,-0.8189859542883079,0.6130644166782953,2.720461892605135,,0.4264789640694857,0.7405035931911544,1.8993533291271967,1.7235333072083938,0.5497710146536977,-0.5561876926148518,-0.8462705063877658,0.2945058177030769,-0.08818344992868958,-0.8843329570880248,-0.0814909298553754,0.43901422008820706,-0.12234853142181747,0.6549726987711486,0.7442894222966839,0.6928507629826698,0.3852469413307517,0.44825729112190266,0.4400469850897258,-0.5555490279228064,-0.5345524758910156,-0.6031148634743124,-0.12097590796363107,-0.22390951498074174,-0.1671092607117216,-0.3387213947406862,-0.2421520006371647,-0.2478565249328876,-0.38589171433274444,-1.8656482807936292,-1.9206414230250903,,,-1.2574123534290111,-0.7486054481900816,0.12144231982322709,0,5.594513918805488
2,discussion_10.txt,"A third limitation involved the research design. More specifically, the research design was a case study. The intact soccer team served as the experimental group and no control group was included. Though multiple sources of data point to the athletes use of the UNIFORM skills at posttest and follow-up, the absence of a control group makes it difficult to say with certainty that the experimental groups positive results were a result of them being taught the UNIFORM curriculum and not some other factors. However, the use of a control group in an applied intervention setting is not always appropriate or feasible. As noted by Anderson, Miles, Mahoney, and Robinson (2002), it is impractical to offer a service to one group of athletes and deliberately withhold the service from another group (p. 437). This was the view of the AD whose mission was to increase student-athlete participation, engagement, achievement, and retention. He felt strongly that if two teams were to be included in the study, that they should both be taught the curriculum. However, due to timing, scheduling conflicts, the length of the curriculum (i.e., 12 weeks), and available resources only one team could be included. As such, the soccer team was a single case, and though the results are positive, they should be interpreted with caution.
Despite its limitations, the current study makes a contribution to the literature on the development of sport psychology and life skills in adolescent athletes. This has been identified as an important area of investigation with researchers studying life skills development of athletes via applied sport psychology interventions as well as the perceptions of coaches, administrators, parents, and the athletes themselves (Camir et al., 2013; Sharp et al., 2013; Sheard & Golby, 2006; Trottier & Robitaille, 2014). It appears that a curriculum like the Psychological UNIFORM can be used to successfully teach sport psychology skills to adolescent athletes. Through multiple sport-themed, classroom-based activities and a physically active component, the athlete participants used several sport psychology skills according to the data collected during, and immediately following the curriculum period.
Few studies have measured athletes retention and use of sport psychology or life skills at a follow-up period after the intervention has been completed. In an effort to address this gap, data were collected at the 4-week follow-up point in the current study. The instrument used to measure the majority of the psychological skills taught within the UNIFORM curriculum was the TOPS (Thomas et al., 1999). This questionnaire is widely used to measure athletes application of sport psychology skills in practice and competition. At the time of the 4-week follow-up, the soccer season had ended. However, analysis showed some significant findings, even at a time when many athletes had no opportunity to use the skills in a practice or competition setting. Data from the EIS support these positive outcomes and are encouraging; they suggest that athletes who were finished soccer, but involved in other sports (e.g., lacrosse) maintained their sport psychology skills, and also that the athletes applied the skills to other areas of their life such as school, and when dealing with relationships. Thus, the current study makes a contribution by advancing the knowledge related to teaching sport psychology and life skills in the high school athletic setting in meaningful ways such that athletes use the skills during, but more importantly after, the conclusion of the intervention program. Regardless, researchers should consider using longer follow-up periods to determine the extent to which the athletes can retain their skills over greater time periods following the completion of the intervention program.
Given adolescent interest in sport and the accessibility to athletes, the high school site appears to be a fertile context in which to teach sport psychology and life skills to adolescent athletes (Camir, 2014). If integrated into training sessions, the GPF activities have the potential to be more authentic and engaging. As noted by a high performance coach, interactive activities were most effective in helping athletes learn life skills (Hardcastle et al., 2015). Regardless of the teaching organization athletes can and should be taught to use sport psychology and life skills. Though there is not one correct way to do this, with its multimethod approach and sport-themed activities, the Psychological UNIFORM appears to be an effective vehicle to accomplish this task.",4,32,26.1875,0,0.39868470873578543,0.3174152108455723,0.3601053090048178,0.3487018472482709,0.0625,0.3988188437393142,0.3816095401061816,0.4354406631333314,0.3751216756313813,0.22535666489663223,0.22889418279166693,0.22799982771835323,0.22946810514245208,0.17221817780436022,1.4135215681358666,0.2857359747976794,0.17142472282306026,1.413780687004663,0.2862961392137345,0.16328321394488274,1.3898909225584863,0.27672930208653196,0.1709402256877465,1.4099868300104235,0.2855904615951756,0.049275362318840575,0.04609833556702627,0.013888888888888888,0.045662100456621,3.016341292902113,3.4612984438928596,0,0,1.1854036364240446,6.448236215382717,8.367611395546902,-0.8189859542883079,1.1260890331454878,-0.10047401727638312,,-1.1443314861160012,-0.6377588066043784,0.2576787969041587,0.2812769318045298,-0.2916434160164404,-0.15526445361251787,-0.17921261567835628,0.8589994471190586,0.0968870294267849,-0.4011431822631817,0.6646254822976159,0.5638900746638716,0.43377938523689047,0.9344981801102561,0.8974909976233758,0.8920011627995819,1.0195473548723397,0.9124880924735297,0.9569863694080977,0.25234627892556855,0.7051893217424058,0.38675199792617565,1.2244631074101506,1.1642077543108236,1.2350560135466853,0.5277783233916656,0.35331522092881074,-0.6471163468206831,1.072323496240362,-0.7156223371312007,-0.563357455967766,,,0.7326431834690663,0.23918319157506626,-1.6727371528780373,0,2.6597473211149785
