68,methods_3.txt,"This study applied qualitative methods to capture an emic account (Jary & Jary, 2000) of practitioners professional practice and understanding and use of MI. Data were collected in the form of one-to-one semistructured interviews. This type of informal interview permits the interviewer to use a conversational style and ask spontaneous questions while maintaining focus on a specific topic (Patton, 2002).
Participants were Chartered sport and exercise psychologists, Registered with the British Psychological Society (BPS) and the Health and Care Professions Council (HCPC). A purposeful sample (Patton, 2002) of 18 UK-based sport and exercise psychologists was contacted via e-mail (available to the public through the BPS website) to participate voluntarily in this study. To qualify for inclusion, participants were also qualified to supervise sport and exercise psychologists in training, and currently working in an applied setting with athletes. Of the 18 participants contacted, 11 (8 males, 3 females) aged between 37 and 65 years (44.5 8.3 years) agreed to take part in the study. Participants had between 10 and 35 years (19.6 7.78 years) of experience, and all had worked with professional, international or Olympic athletes. Participants had worked with athletes from team and individual sports, such as rugby, football, equestrian, judo and shooting. Participants had also worked with youth and adult athletes, and able-bodied and disabled athletes.
Two pilot interviews were conducted; one with a BPS chartered sport and exercise psychologist, and one with a BPS sport and exercise psychologist in training. The purpose of this was to test the interview guide, check clarity, and practice interviewer skills. Each member of the research team contributed to the final interview guide (Appendix). Questions in the interview guide focused on key themes concerning professional practice and applied techniques, therapeutic alliance, and awareness and use of MI. Questions included, When you first start working with a client, how do you begin to build a relationship/ alliance with them? and Which specific communication skills do you employ to underpin your work? Interviews were then conducted with participants, using the finalised interview guide.
Participants were sent information sheets before their interviews, which stated the aim of the study and gave a brief description of the interview procedure. A consent form highlighted participant anonymity and detailed their right to withdraw. Voluntary, written, informed consent was given by all participants. Ethics approval was provided by the governing institution (HWB-S&E-38, Sheffield Hallam University). Participants were afforded an opportunity to ask questions before commencement of their interview, and demographic information was collected at this point. All interviews were conducted by the principal researcher, who has previously conducted interview-based research, is a sport and exercise psychologist in training with the BPS, and a member of the Motivational Interviewing Network of Trainers (MINT). Ten interviews took place using video conferencing software, and one was face-to-face. Video software was used to accommodate participants since they were spread across the UK. Interviews lasted approximately 60 min, were audio recorded and transcribed verbatim.",4,26,22.73076923076923,0,0.5130592262744904,0.36272023488695804,0.4784693258504073,0.41379289723755347,0.0,0.4497938555857492,0.394999945798941,0.4358398592080733,0.4088847801546792,0.270425052515098,0.21650119127598516,0.2922501618512953,0.228299001863213,0.17030464547031043,1.408146051858219,0.28458351775882607,0.168020882883669,1.3978420571340644,0.281398167009415,0.1699709954222704,1.3991160660152933,0.2836484467970431,0.16609092302441408,1.3879444631058244,0.27939861959681034,0.12121212121212122,0.049521623177229586,0.06349206349206349,0.037698412698412696,3.122630800179464,3.536191918648074,0,0,1.2136246968993447,6.646475611416926,8.720226795571334,-0.8189859542883079,0.356552108444699,-0.8469785882019673,,-0.3000432559687116,-0.2661215197487633,1.1173675370309317,0.7871354443690275,-0.6381081815864973,0.9931096282599,0.26002332603449635,0.8620812493042609,0.7277999899327612,0.8948166293391316,0.14992616199919315,1.388110521387397,0.3986742738604379,0.8955178705964314,0.8840498906122806,0.8778462839711635,0.8486549974576151,0.8093010252916895,0.8014630551108983,0.8541749256749922,0.8729587697896685,0.9142957170716279,0.6942737937611603,0.7434655654963745,0.7079945031515277,2.7889133004152464,0.4559783663529071,0.7017344028002477,0.4906899120904994,0.23953824962295533,0.2325822820266501,,,1.3190458191494083,0.8768525223411707,-0.3297409432979738,0,1.2940823020846166
69,methods_4.txt,"Grounded theory methodology aims to explain a general pattern of behaviour (Glaser & Strauss, 1967). In the present study a constructivist, grounded theory was chosen according to Charmaz (2014), who stresses that the researcher is a part of what they study, not separate from it (Charmaz, 2014, p. 320).
The women were recruited retrospectively from participants in a randomized controlled trial (RCT) evaluating web-based support carried out in Sweden for women with T1DM during pregnancy and up to 6 months after childbirth (MODIAB-Web). Women from both the intervention and control groups at three of the six included hospitals were asked to participate. The health care in the respective hospitals differed somewhat. In pregnancy all women with T1DM had frequent follow-ups at a hospital-based special antenatal care unit, which ended with a final followup around 6 weeks after birth. Parental leave in Sweden is financed by the Swedish Social Insurance Agency and the employer, and parents can use 480 days of paid parental leave for each child. Most of these days can be divided between the parents. The majority of mothers take full-time leave during the first months after birth (the Swedish Social Insurance Agency, 2010).
Based on a purposeful sampling procedure, eligible women were contacted by phone after data collection for the MODIAB-Web study was completed, that is, at least 6 months after childbirth, and asked about their willingness to participate in the present study. Of 18 women contacted, 4 declined and 14 agreed to participate. Interviews were conducted between 2014 and 2016. The participants had a median diabetes duration of 24 years (range 530). Their median age was 33 years (range 2540); eight of them were primiparous and six were multiparous. One woman was single, and the others were living with the father of the child. Most women had a university degree (n = 8), five had completed secondary school, and one primary school.
The interviews were conducted 717 months after childbirth by three different researchers at a place chosen by the women. Five interviews were conducted by telephone due to distance. Each interview started with open-ended questions such as Could you please tell me how you would describe your situation as a new mother with type 1 diabetes and how you handle your situation as a new mother with type 1 diabetes? In accordance with the methodology, follow-up questions were posed, based on emergent data from previously analysed interviews (Corbin & Strauss, 2008). The interviews lasted 2560 min and were audiotaped and transcribed verbatim.",4,21,23.476190476190474,0,0.3962626613676548,0.24875954260073957,0.41617285956939065,0.38918226031320435,0.047619047619047616,0.37166503828484565,0.37421201539235677,0.4008880165612532,0.35370407178406416,0.2465046887906889,0.22901486007015215,0.22918526325167882,0.23721059559826757,0.19051085111241822,1.5105489732671387,0.3102340584793454,0.17063178003637997,1.4017942298301473,0.28560288883932416,0.17062870843432718,1.419804680065325,0.28792449262711095,0.17274338720883067,1.417165792744188,0.28869464965991987,0.04,0.02081876456876457,0.0,0.031914893617021274,3.1928341279490513,3.5877425713129094,0,0,1.1904600642183423,6.376090971206866,8.755663499649268,-0.8189859542883079,-0.2847286621392917,-0.6859997894117362,,-1.1622105218468395,-1.2009415178741287,0.6649025731108364,0.5958725873423548,-0.374135026866454,-0.7669901850759502,-0.42186835058099026,0.592252280881991,-0.3033322051797602,0.20697684398496158,0.6696373886749591,0.5790971583004781,0.6662661078465706,1.307135764903129,1.1401013196869947,1.192895160885144,0.9797370628128866,0.8348874849068427,0.9349738729363979,0.913362046745556,1.249204123185837,1.2403188333396724,1.421608353981524,1.3012389772776853,1.4992904772792375,0.23623271463258147,-0.4048098825296073,-1.0247945567145438,0.06828649366897752,0.8704138032137654,0.7804432687093821,,,0.8377101985197111,0.007116253862880542,-0.19477417992524856,0,-0.28299279511648134
70,methods_5.txt,"Twelve school systems had comprised the LSES-II population. One additional large system was added to the sampling pool for LSES-III. Nine pairs of schools were chosen using the following procedure:
Within individual school systems, third grade school means on the Total Reading section of the state Basic Skills Test (BST)1 were computed. The BST is administered in late March of each year. Mean scores were developed for both the '82-'83 and '83- '84 school years.
Within each large school system, and among contiguous rural systems, regression models were developed in which mother's education, father's profession, and student body racial composition were independent variables predicting mean BST reading scores. A total of seven separate models were used.
A school was considered for inclusion in LSES-II if a) the school scored above (or below) achievement prediction both years, b) the school scored substantially above (below) prediction at least one year, and c) a matching opposite directional outlier of similar racial composition was identified within that system (or in a contiguous system in the rural models).",4,9,23.333333333333332,0,0.3393789455294609,0.34132298702994984,0.1891688983887434,0.22574187939365703,0.0,0.5019690102587143,0.46406294223852457,0.5463314524127377,0.5143232930917293,0.3583396981159846,0.2724038961653908,0.24728449102905062,0.28649593523393074,0.13057981752839556,1.1460488024617201,0.22359404967705232,0.15922457672647228,1.3626041704310283,0.27021938182570976,0.16812015143600556,1.3874262380992037,0.27779117892269817,0.16302378325597688,1.3891595154454426,0.2756627054221324,0.0,0.025,0.13333333333333333,0.025,3.163224440113553,3.529040805099035,0,0,1.0905817630082335,6.443378108819285,8.500781015340868,-0.8189859542883079,-1.8238025115408696,-0.7168507631356624,,-1.5821139479135569,-0.4416432264030088,-0.9838480741890261,-0.6743129143287698,-0.6381081815864973,2.16852073997518,2.525447613743338,1.7150786982516395,2.6980727266284865,3.4228380113006023,2.471648417115053,0.8112788863075184,2.146175853940465,0.0862887496638001,0.22869382907437516,0.12875239031406083,0.4070297969454411,0.5811701124031462,0.4465076472273983,0.6876188060762434,0.660366305896576,0.46771380445907373,0.358933881697237,0.766658346158618,0.3899862968484117,-1.0210577231409697,-0.27941615871572867,2.600916258266518,-0.43674766645836,0.6043291488483735,0.15658293143978086,,,-1.237651183741029,0.223556299932604,-1.1655378229505216,0,4.009811844641309
71,methods_6.txt,"Seven athletes (4 male, 3 female) were recruited to take part in the study. They represent a range of different sports (Rifle Shooting, 3; Athletics, 1; Football, 1; Fencing, 1; Swimming, 1) and have all competed at professional, national or international level (including Womans Premier South, World Championships, World Cups, European Championships, British Championships, Commonwealth games, and Paralympics games). In accordance with Swann and colleagues (2015), participants therefore represented competitive-elite and successfulelite athlete populations. Participants were aged 2068 years (M = 33.29, SD= 16.40) and were selected from a range of sports to provide and explore different contexts of counterfactuals. To provide free recollections of counterfactuals, participants were also required to be involved in regular training and have recently competed.
A qualitative interview methodology was u to explore the nature of counterfactuals and their perceived consequences in elite athletes. Semistructured interviews were conducted to gather participant data underpinned by a phenomenological perspective, which aims to understand the athletes personal lived experience of a phenomenon (Smith & Osborn, 2003). In relation to the phenomenological approach, an Interpretative Phenomenological Analysis (IPA; Smith,1996) was used to analyze the data obtained as it offers psychologists the opportunity to learn from the insights of the expertsresearch participants themselves (Reid, Flowers, & Larkin, 2005, p. 20).
The semistructured interview schedule was constructed to suit the use of IPA and follow the guidelines set by Smith (1995) and Smith and Osborn (2003). The interviews were designed to allow the interviewer to frame questions in a broad and open manner and to prompt for more detail if needed. Using suggestions by Smith and Osborn (2003), the first section of the interview was designed to build rapport with participants, through the discussion of their history in their particular sport, their season so far and then a discussion of a recent competitive event to explore the use of counterfactuals and their perceived consequences.
Participants were asked to recall their personal experience of counterfactuals and their perceived consequences around a recent event. A general open question Tell me about your personal experience of a recent positive/ negative event that you thought could have turned out differently. . . was used to get a detailed outline of the event and the counterfactuals experienced. From this, the interviewer used probing questions to get more details on the counterfactuals type (e.g., upward or downward), content, direction (e.g., self or others), structure (e.g., additive or subtractive), controllability and their perceived consequences (e.g., thoughts, behaviors and emotions). These probing questions were designed to be a gentle nudge from the interviewer (Smith & Osborn, 2003) to reduce researcher bias and avoid leading the participant to a predetermined conclusion. As most of the initial counterfactuals were of an upward nature, the process was repeated to explore downward counterfactuals during the specified events. A draft of the interview schedule was piloted in an interview carried out with a novice squash player. This informed the final draft of the interview schedule.",4,19,30.894736842105264,0,0.5378350081543127,0.3679289808381098,0.47575097584298676,0.4240841925210719,0.0,0.33973645805522346,0.37940231038280436,0.40224781484367256,0.3850436037691095,0.23550630643060713,0.215123304657045,0.2649318417350727,0.23455692280658721,0.1622792101539844,1.354765703660102,0.27265102045306455,0.1685290393252742,1.394641011292416,0.28089849282197177,0.16317406616320326,1.3809199631862414,0.275897559491608,0.1656857890995692,1.3834649679070197,0.2780979032698033,0.055907407407407406,0.03055860805860806,0.03076923076923077,0.027972027972027972,3.0696391549780726,3.502356007693059,0,0,1.1563877898623662,6.092929506149845,8.625284359916773,-0.8189859542883079,-0.541240970372888,0.9160858636202306,,-0.11715373228830143,-0.2233941566325245,1.0976239109240922,0.8671147860041651,-0.6381081815864973,-1.4862828870990592,-0.2516148003745548,0.6027499525359622,0.2822927598442018,-0.10928611292325788,0.09270048688117193,1.0376638145525323,0.5865832598357149,0.7320328084174769,0.7505760184553174,0.731287195181586,0.8741673757678942,0.7885773787175484,0.7855971043749185,0.24252414852762397,0.5420424927112085,0.3233365614443644,0.6499792441192888,0.6579614713631946,0.5972750254760709,0.7362384952101186,-0.11271553275151405,-0.1880920609496832,-0.21968349542998844,-0.23666614928871982,-0.1270130790960771,,,0.12972576599084915,-0.9037187543839211,-0.6913454880896645,0,2.0983169537995328
72,methods_7.txt,"The pilot program was conducted in a migratory slum in Worli, Mumbai. A migratory slum is defined as an area where families live in tents on the street, with polythene sheets as roofs, open drains as toilets, and no access to electricity or sanitation (World Bank: Sanitation). The residents of the Worli community in Mumbai are all Hindu migrants from the Surendranagar and Rajkot villages of the Indian state of Gujarat. The average income of each family in the Worli slum is between 6000 and 10,000 rupees a month, with about six people per household. This equates to about $90$150 a month, or about 5083 cents a day per individual, placing most of residents under the extreme poverty line of less than $1.25 a day (World Bank: Poverty). While the male to female ratio is roughly even, women are the primary earners in the household. All children were allowed to participate in the initiative; however, an Adverse Childhood Experiences survey was conducted by all participants before formally enrolling in the curriculum. The ACE survey can be found online (Centers for Disease Control and Prevention 2016). This initiative was approved by the The Hero Lab, a non-profit organization. Written informed consent was obtained from each childs parents in accordance with the Helsinki II Declaration (Carlson et al. 2004).
The Hero Labs Stage 1 curriculum is a 6-month interactive program rooted in positive psychology interventions focused on themes that promote well-being (e.g., grit, empathy, hope). Table 1 lists examples of interventions from the curriculum. The lessons lead to a student-led project, in which participants exercise their strengths and skills in a designthinking process to ideate, prototype, and launch a project in their neighborhood. Classes were held 5 days a week in Worli for 6 months on a large tarp in front of participants homes. The curriculum was taught by a trained community leader of the same background in regards to faith (Hindu), language, and geography (same community).
Once enrolled into the curriculum, but prior to its intervention, students were administered the eight following surveys by a Hindi-speaking team member to assess their baseline levels of well-being on specific psychological metrics: the General Happiness Scale, the Meaning in Life Questionnaire (MLQ) for Search (Search for Meaning in Life) and MLQ Presence (Presence of Meaning in Life), the Gratitude Survey, the 12-Item Grit Scale, the Toronto Empathy Questionnaire (TEQ), the Life Orientation Test (LOT-R) for measuring optimism and pessimism, and the Curiosity and Exploration Inventory (CEI-II). The surveys were administered orally due to low literacy levels and literal language translation issues. Copies of the surveys are available online and available upon request.
The primary objective was to see whether through a positive psychology curriculum, the students would be able to implement a project that shows their determination toward improving their community and its future. Secondary objectives were to see if the variables highlighted by the aforementioned surveys were impacted by the positive psychology intervention.",4,21,28.0,0,0.3645530235022306,0.20078843001974747,0.4147837433964014,0.36086729770159404,0.09523809523809523,0.44718296634845245,0.3826503581277883,0.48946675565093756,0.3948697701681596,0.23919281688256142,0.18856326577205879,0.2131012128148642,0.2256996337906031,0.14950294963667077,1.2952500373388505,0.25597554131478745,0.1497958885839041,1.2885491166151732,0.2557527720063965,0.1508801423193743,1.2981221909314795,0.25538877172372,0.15018251527167217,1.3011748038883666,0.2572170719984789,0.020833333333333332,0.04591242091242091,0.05263157894736842,0.020242914979757085,3.1431878166663343,3.54523342272394,0,0,1.1663605271340078,6.855974866221304,8.848488473947317,-0.8189859542883079,-0.2847286621392917,0.29094771184593277,,-1.3962842876483053,-1.5944487392975093,0.654813294591295,0.3758213687433778,-0.11016187214641064,0.9342910537829837,-0.14507140335352456,1.276082030123823,0.4659090421967672,-0.0032790058745218622,-1.0103773247919714,0.37276666344694076,0.32062205442200037,0.47176932578265157,0.6017612072739355,0.5264731512299095,-0.06634461921465086,0.10173594050186624,-0.012844715727998316,-0.863797219057213,-0.963726671287507,-1.240336786476862,-1.0450418095834215,-0.9127838064447069,-1.1801415286085335,-0.3662189534672452,0.3477397083235211,0.4064070807779807,-0.784184745163215,0.4242719306087723,0.3286719935634886,,,0.33694829138661114,1.5507410242212543,0.15876565023534203,0,1.159087357690799
73,methods_8.txt,"Articles were located through a PsycInfo search (search terms: Oxford House; National Institute on Drug Abuse grants DA13231, DA19935, and DA16037; National Institute of Health, Institute on Minority Health and Health Disparities grant #5R24MD002748) and were cross-referenced with records maintained by XX University. Articles were included in the current study if they focused in whole or in part on Oxford Houses or their residents. We included articles from peer-reviewed journals and one book chapter that had empirical data. Magazine articles and non-peer reviewed journal articles were excluded. The aforementioned inclusion criteria resulted in a total sample size of 126 peer-reviewed articles (including the one book chapter). These articles were published between 1995 and July 2015. For the purpose of coding study design and types of data analysis, we only included articles that reported data analyses; thus, 12 theoretical or review articles were excluded from further analysis, resulting in a subsample of 114 empirical articles with data. We had hoped to find articles from different research teams, but instead, we found that all of the articles included authors who were currently or previously associated with the DePaul University team conducting the present review.
The study design coding scheme was created using study designs presented in previous research and advanced psychology research methods textbooks (e.g., Bodner, 2006; Goodwin, 2005; Montero & Leon, 2007). The research team integrated the study designs presented in these resources to create the following categories: (a) descriptive studies using systematic observation, (b) cross-sectional descriptive studies through survey research, (c) longitudinal studies through survey research, (d) experiments, between-subjects designs, (e) experiments, within-subjects designs, (f) quasi-experiments, (g) ex post facto, retrospective studies, (h) ex post facto, prospective studies, (i) measure development studies, (j) ethnographic studies, (k) case studies, (l) action research studies, (m) qualitative interviews, and (n) mixed methods studies.
In some cases, a guideline set by one resource was modified to parallel guidelines from other resources and capture the extent of the research articles surveyed. For example, Montero and Leon (2007) advise that cross-sectional and longitudinal descriptive studies are solely descriptive and should not have hypotheses; however, many Oxford House articles were descriptive in nature but still proposed hypotheses based on existing theory and research. With consultation from the third author, the first and second authors developed this coding scheme. The first author coded all of the articles, and the first and second authors coded a subsample of articles, with high levels of agreement. If a question about coding arose, a discussion between all authors took place to make a final coding decision.
For coding data analyses, every analysis employed in a research article was counted to obtain the total number of times the analysis was used across all Oxford House research studies. Additionally, the main or most important analysis was coded in every study to create a count of the number of times the analysis technique was used as the main analysis among all Oxford House research articles.",4,17,35.76470588235294,0,0.5528038785560057,0.4057330038836774,0.5773728346352333,0.5506126611427005,0.11764705882352941,0.3608657030499209,0.36019597470870185,0.4032040541842341,0.358005199216543,0.2706918758103403,0.22829778317341023,0.3010468205031103,0.26348954021115023,0.16383267193534115,1.3025352713274136,0.268390588856881,0.17438811271441623,1.4026617947135356,0.28545691207092644,0.16895731857356763,1.367669179085708,0.27666633552371034,0.16191101071608074,1.3521998726311888,0.2714730093054124,0.10448717948717949,0.08716178500385661,0.10344827586206896,0.040911747516072475,3.0387940141449197,3.4141051241595957,0,0,1.1433599386724387,6.73013034407693,8.559743969735521,-0.8189859542883079,-0.7977532786064844,1.967788871899343,,-0.006656731988626449,0.08671239013915116,1.8357128173559845,1.8504374232106544,0.014060788898315656,-1.0102795191245604,-0.8816265513425809,0.6101321405778275,-0.22295935202384914,0.9024892416890716,0.6398561215057093,1.5009564080511357,1.4553540300798449,0.7636781691870163,0.6199774314621723,0.6789590901263686,1.1683265846510926,0.8405041205043557,0.9303387321302521,0.7629548748765765,0.30106231227839403,0.3819511712167326,0.23727100558186032,0.061176893882055876,0.03335129809389402,2.263210567838018,1.5847930753115929,1.7882569376673147,0.7253780997511231,-0.5138530849646077,-1.0649103438041712,,,-0.1409786705667761,1.1459416058325107,-0.9409673014923694,0,3.9431291899153917
